{
  "contract_id": "00000000-0000-4000-8000-000000000010",
  "seller_agent_id": "00000000-0000-4000-8000-000000000011",
  "artifact_uris": ["s3://example-bucket/artifacts/example.json"],
  "artifact_hashes": [
    "abcdef0123456789abcdef0123456789abcdef0123456789abcdef0123456789"
  ],
  "artifact_mime_types": ["application/json"],
  "artifact_sizes": [128],
  "output_schema": "https://a2a402.market/schemas/example-output",
  "result": { "status": "complete" },
  "completed_at": "2026-07-24T00:00:00.000Z",
  "signature": "0xEXAMPLE_SIGNATURE_NOT_VALID"
}
